userName,score,content
Toni Fairbairn,5,"A nice clean app. I'm not getting all the trashy ads for Temu and Amazon, etc, forced upon me. This browser actually gives you the results you search for. If I am searching for something that's what I want. I am much happier with Ecosia than the very commercial browsers, I find it saves time."
Topher Mohegan,5,"Greatest browser in human history point blank period! 💯💯💯🙏🏾🙌🏾 With every breath I am at the edge of my seat for what they do next! Infinite potential to be had and I am all for it. I mean it's already the best so nothing to worry about being worse when it's already the best. Only adding new innovative, enhancing, and engaging feature or capabilities. Thank you Ecosia TRULY!!"
carelessfrog,5,"Great, eco-friendly browser, love the look of it as well :)"
Noah Bühler,3,"Great app, Ecosia is great, as you actually have a negative carbon impact where searching for stuff. The app works as it should on my Phone. But on my Tab S8 ultra, it constantly crashes where opening the app. I need to open the app like 5 times before it propperly loads with all my previous tabs. (Before that it just loads a new tab, and closes itself after like 0.5 seconds.)"
Boyan Chongov,5,"Lovely, our planet really needs help❤"
anneeq008,2,"Although I love the ethical credentials of this browser and I've been using it for the best part of a decade. This has been incredibly buggy for the last month or two. Links are becoming invisible, webpages keeps quivering. It's deteriorated a lot. You need to fix it!!"
Tanmoy Sarkar,5,"Choose Green 💚🍏, Choose Ecosia Help Green Our Planet"
Mohit Mishra,5,"I have been using this browser since a yaar. From my experience more than 95% of the time, it gives the same search results as Google. So it's better to use ecosia, since you will also make environmental impact. Just a few times it takes a little more time to open some websites. Rest all is fine"
MOHIT MEENA,3,Important Features which are missing first import of My Passwords and second export and import of My bookmarks. 📈📈📈
Janet Phone,5,"Ecosia works just like other browsers (Chrome, Safari, Firefox, Edge) but instead of adding to Google's profits when you search, they plant trees on your behalf when you use Ecosia to search."
Dat,4,"This app is phenomenal. I appreciate what Ecosia is doing, except for the usage of AI. Please consider allowing users to limit the functions and data collection that the AI program uses/collects. This would probably be beneficial for marketing and users."
maja sibag,5,The app is very helpful and also has a good advocacy which is protecting ang restoring the planet earth
Andi Suwito,5,"Very good and fast browser. And more, it's Green and environmental friendly."
Erisa Demiri,5,"I have been using Ecosia for the past 3-4 years and I am satisfied with the privacy, speed, interface, font of this app. It is satisfying to use. There is no downside, as it uses ad revenue to environmental aid."
Skeleton in your body,1,"You implementing ai has proven that you dont truly care about environment. You know how much ai takes from environment just to do what it does yet you implement it in your own app, yikes."
James Crowfoot,3,It is good for the environment and is a decent search engine but the top 2-3 search results are sponsored results which result in a poor browsing experience
First Last,5,We only have 4 years in the climate clock!!! Where dead!!
CatboyFanboy (Catboy66),4,"Now whyyyy does this app have an AI feature. Isn't AI bad for the environment? What's up with that, ecosia?"
Mateus,5,Save the environment and plant some trees! :)
Ethan,3,Last time I used this app was in 2018 Since then it seems like everything about this has become subpar from what it used to be. Where is the personal tree planting tracker? Focusing on collective help rather than individual seems like a great way to get people to uninstall your app despite the noble cause. I planned to start using ecosia again until finding out I don't get my personal stats which is so lame and doesn't incentive me to search extra. Pre update 5/5 - post update 3-4/5
Michelle Broderick,5,It's always great for trees to grow l love ❤️ 😍 to see them. As you know they are also good for the environment
izzy !!,5,"It's a great place to browse, and the best part is that you're making an environmental change just by browsing! You can't go wrong with this app ;) thank you Ecosia for helping nature!! We appreciate it! ♡"
Kim Conway,4,"I'm never sure how to rate search results when it feels like I wouldn't know if I'm missing detail that I'd get with other apps. But I prefer to continue with Ecosia as I really respect their general ethics. And I'm so glad that my phone will let me open facebook links with their app with only about 4 extra steps. If FB used Ecosia as a default setting, I'd probably be happier though and they'd definitely get to plant more trees."
Afshin Rezaei,2,Told me this is about green world but I didn't see anymore
Hannah Fluffgirl,5,"Ecosia app is really good‼️ But add photo picture like in other search engines, it will really help! Thanks"
haira,5,a very useful app!!! i use ecosa more than my chrome.. doesn't have any viruses🫶🏻
Samuel Guevara,5,Nature 🌟
Lisa Golden,2,"Do I have to uninstall and reinstall to make it work better ? It says Ecosia is not responding do you want to wait or close app ? It was a better browser even 3 years ago. It is getting more and more unreliable on my ( 2 different ) Android Tablets and my Android Samsung Smartphone . Still using this but it still stops for no good reason . I would change browsers but don't want to lose all my years of favorites , bookmarks etc."
teshager abebaw,3,"I don't see any significant difference in the basic architecture of this apk from Google Chrome. 🤔🤔 It makes me wonder if Google is expanding its tracking operations on countries advocating natural resource conservation using this apk. But If you have an interest in natural science or environmental conservation, this might be of interest to you. Personally, since I didn't see any basic differences from Chrome, I chose to add the search engine to my DuckDuckGo instead of installing the browser."
Umang Gupta,3,YouTube background playback doesn't work on Android in Ecosia
Chris Chambers,1,Ecosia web instructions to import my data including passwords is wrong. The start panel with a lead to import data doesn't show and no lead into from browser settings. De installed. I don't want 103mb update downloads with a browser that cannot do what it's devs say it can do re importing. Not with my net connection data limits or somewhat limited phone app space.
kayan thomas,4,"I really like this browser. I've been using it for years because of its claim to help the environment and I hadn't even noticed how convenient it was until I tried using some other browsers. The sites I visit tend to have a lot of pop-up ads but because of the ""block annoying ads"" feature I didn't even notice them. It wasn't until I visited those sites on other browsers that I realized how frequent those ads actually popped up. I gave 4 stars though as it tracks my location even if I don't want"
Ingrid Pepler,5,Ecosia is amazing. It's an excellent browser and then there's the added bonus of knowing that you are helping to save planet earth
milo,2,The objective that Ecosia has is admirable. My problem is the limited search results to answer what you ask. In the past it was indicated how many trees you've planted with your search revenue.
Samanta D'Aversa,1,I've been using this browser for years but the choice to implement AI chat (which we all know is currently putting strain on the power grid and increasing our emissions exponentially) is making me seriously reconsider my support.
Tal Turgeman,3,"The idea behind the browser of planting tree is amazing and I will use this browser as my secondary browser, but the ad blocker and search results is pretty bad, I use brave browser as primary until this browser improves and than definitively rather use this app to help the cause"
Saoirse Ivy,1,"Ever since I updated this app, all that I've experienced is incessant lagging. I still have to refresh/reload the page even though it's unnecessary. I also have to deal with the app logging out OR starting over again after I switched to another app and go back to Ecosia again. Please fix this ASAP."
Kyla R,5,"coming back here now that Google has implemented the stupid AI overview tool that burns up unnecessary power and gives useless information, ecosia is a great alternative that actually does good"
Camyl Grayzel Abagat,1,"Keeps crashing after 2 seconds of opening, restarting phone doesn't work as well as clearing cache or data"
Shyanne O'Donnell,3,"I actually love this app. I love being able to group like tabs in one area. One for shopping, one for news articles etc. the reason for the 3 stars is I pinned my fitness application from the ecosia browser to my home screen. While trying to remove it I accidentally deleted the whole app. I lost all of my bookmarks(46) and every single one of the tabs I had open(about 74). I am really upset and its highly unlikely I'm gonna use the app again."
Claire Voyce,5,"Everyone should use this. Search results just the same as everyone else's. The only difference is that this is making a huge positive impact on the planet. I didn't believe it at first, so I checked. Each individual that uses this produces benefits for the planet. There's no loophole. They don't share servers so their servers are all powered by renewables. There's no reason not to and a few billion reasons why you should."
For Service,5,Best app to plant trees and fight Climate change while you search Thank you so much Ecosia! :)
Raghed Khaled,5,I liked the idea of the app it is really creative and helpful for our environment
Samantha Flores,5,I love ecosia! Never going back to using any other browser. I love my privacy and fast downloads.
Celine RocaM (Nel),2,"Lowered my rating because while I love this browser for its cause and what it fights for, it has become absolutely useless since a couple days and can't find a single thing I'm asking. I'm French, I tried searching in French and English, changing the default region to France or other countries, in vain. The browser keeps telling me there's no result to my research while others easily find it. I don't want to let Ecosia go, but as of now, it's of no use to me. :("
Nikita Agrawal,5,We entirely support your purpose!!!! ❤️💪🏻 I wish ecosia could get more and more famous! Get 100 millions of downloads
John Collins,3,"I want to recommend this to people I know, but the AI chat feature makes me hesitate. The exorbitant energy & water requirements of AI datacenters runs highly counter to Ecosia's mission, no? As for the tool itself, I'm skeptical. The Help Center page on the AI chat instructs you to fact-check the results. I don't think a search engine should be using a notoriously incorrect & misleading tool on its platform at all! It's sketchy at best, and using it comes with tangled ethics & copyright issues."
Kathy Fugazzi,5,I love to be able to plant trees by searching great search engine. But the data is kind of a problem but I still love ecosia
Meka Taylor,3,"I love it, however adding an ""ai chat"" section in the name of greener searching when Ecosia cannot confirm whether the third party they are using for their ai chat function is even sustainable!"
Anushka Shavinda,5,Better app.easy work.so I recommend this app to U
Patricia Bitavarra,5,I really love Ecosia since I love nature. The reason why I'm using this app it's because for my country 🇵🇭. I really hope this app plants trees for every search I make because this is the least I could do for mother nature. Thank you for making such app.
Ted Maxa,1,Does not allow to take pictures of flowers to get the names of these flowers. Opening the app just open a kind of Ecosia webpage. Useless app
Rajesh kr M,5,Ecosia plz more work in INDIA..💐🙏🌻
Eyad Shady,5,i really like how its helping the environment in any way possible i would recommend to download it and lets save iur environment ❤️🟥🙏
jane wilde,3,Love the idea but Ecosia blocks so many links that it is causing a problem and I will need to go back to Google as my default
Nikolas Rucker,5,10/10 recommended GET this app. I love planting trees with my searches.
Val Havard,3,"Why, when I always use Ecosia, do I keep getting a banner on a website saying my CHROME browser has security issues and it isn't up to date, even though it is not meant to be using the Chrome browser. The Chrome browser, which I don't use, is up to date. I even uninstalled updates (I can't uninstall Chrome on my device) then did update. Yet a website still keeps showing a banner saying my CHROME browser has security issues and it isn't up to date, when I searched for the website using ECOSIA."
Gerry oavenga,5,I downloaded ecosia because it's so hot in Philippines
Camille Fafin,3,"I love the concept & tree planting, have been a user of ecosia since before the 1st million. The concept is based on advertising, and I've been increasingly frustrated at the adverts we see. Some of my searches leed to 0 ads, but oh well. What frustrates me most is Temu or Amazon ads There should be a ban on the like of them. They are there for profit, and exploitation. If we plant one tree when buying something off Temu, the world is still left worst off. ECOSIA, PLEASE select your advertisers."
Jared Dante,3,"It is very good for the environment, but I wish it had accounrs, so, if you accidently delete it, you can get your progress back, and also, when I try to get it in a group of other apps, it just dissapears."
Hiraya Solveigh,5,"this will be a good contribution to our mother nature, thanks for making this!"
Rajat Kumar Goswami,5,if what it is described is true then I am 100% going to browse from this search engine. let's save the planet.
Arend-Jan Franssen,5,Saving the planet combined with browsibg
LadyAJ,5,Works well. Ratings by watchdog orgs of Ecosia's mission success are favorable.
Pieter,1,"The preachiest browser I will never use. This browser has an advertisement that I essentially keep seeing every 5 - 10 minutes on YouTube, I can't escape it so here is to hoping a negative review will make it clear to Google's ad sense that I am not interested, I will not be interested and I am starting to become resentful after telling Google this through every tool available to me."
Franziska Weisgerber,3,"This app is a great way of helping the climate by making one small change. It has worked great for me for about four years but unfortunatley the ""ad block"" feature seems broken; no matter how many times I try, every single time I click on a new YouTube video I get ad after ad after ad. What a shame because ad blocking was the primary reason I switched to Ecosia. It has been like that for a few days and I hope it'll be fixed. HOWEVER: This app lets you look into their tree planting projects."
From Dust To A Lifeform,3,"I've been using this as my default mobile browser for a long while because of the adblocking (especially adblocking for youtube, I don't even use the youtube app anymore) but sadly youtube ads are no longer blocked for some reason. It could definitely use an update, I loved using Ecosia for watching videos."
Ashlyn Roberts (Ash),3,"I've used this for years, had no problems except the occasional crash. Recently, though, I cleared my cookies for the websites along with other things to free up space. I didn't expect my counter to be reset. Couldn't even sign in to recover it. I read why this is, but it's still devastating to me. I had 185 trees. I felt proud of me. Now I just feel.. sad."
Colyn Manalang,5,I love LOVE this app. You don't just help people gain information but YOU ALSO HELP OUR NATURE. And that's everything. Thank you very much for establishing this kind of application. I hope there are more people like you out there that really care about our earth and are actually doing something to fight environmental issues. All love! 🫂💚
Alexandra,5,"What is there to not like? Works perfectly as search engine and supports a great cause. Recently heard about ones that help clean the ocean, would be great if ecosia would team up with one so users dont have to chose which cause to help."
Richard Sawyer,5,A good browser that plants supports nature conservation🌴👍
yasamin why,1,"I've stopped using Ecosia after years of loyal browsing, because of the AI integration. You can't claim to be an ethical and eco-friendly company, then sell out to AI- mass theft of intellectual property and a polluter on an industrial scale. I even had an Ecosia T-shirt. Sigh. Firefox and DuckDuckGo can do the job you failed at, Ecosia, and it'd behoove you to know that. Edit: what a rubbish, corporate sell-out response. Proving why I was right to ditch Ecosia."
James GrantVIII,5,"I'm boycotting any jewish owned brands, so I'm switching to Ecosia. Don't disappoint."
puppy tree,4,I wish incognito tabs didn't close out when you reset the phone or when accidently refreshing the ecosia app
Fantasy World,5,I like this search engine. Very similar to Google and I barely notice the difference but I'm always happy to help the environment.
Mary Copper,5,"Such A Great Idea! I was worried it wouldn't be as comprehensive, but it really is and more so if we use it more. AI, images, all the same options. Sometimes just need to be a little more specific with what I need. But I actually feel good going on the internet now. Highly recommend!!"
Iggy Price,4,"They have been around as long as Google and Don't sell information supposedly. I love that and the planting of trees. I don't like that they supported Biden instead of planting trees in 2020. The green new deal is anything was green. And I noticed that a lot of sites are ""down for review"" so I have a bad feeling they are becoming more and more like Google EVERY DAY... Jus' sayin'"
Princess Millan,5,Been using Ecosia for awhile and it does have its pros and cons but what I LOVE about it is its ad blockers! Great when you wanna watch videos or read long content
SunshinE Daze,5,"Love this browser! Anything I can do to help the environment, I am sold!"
sophia frances,5,I've found ecosia a helpful app and I like the fact that using it helps restore our environment
Sum1,1,Here's some old bugs that Chrome had in the past: 1. Page scrolls down when typing a letter (when screen is splitted) 2. Occupies over 250MB RAM which causes low performance 3. Some tabs resetting itself when tabbing on 4. Doesn't have a translator service So I hope Ecosia will better for me and environment after an update.
seanmoran,1,I used to have Ecosia as an ethical web browser and search alternative. Now they started using A.I. despite admitting they don't know about its power consumption and environmental impact.
Rahma Zuvita,5,LOVE ECOSIA SO MUCHHHH.
Tkairah Leigh,4,"Love it. Works the same as any other web browser, but I'm helping the planet just by looking things up. I kind of wish, however, that there was some customization. Like backgrounds and color themes. Otherwise, this is a great app."
Kayli Robles,2,"Gotta say I really do not like the new theme, it was much prettier when it was the lighter theme and the logo was like a planet. Next, the search options are VERY VERY limited compared to any other browser, and most often I can't find what I'm searching for. Finally, the pop-ups I get every time I open the app are a complete deal-breaker. Enough of a deal breaker that I'm uninstalling and going with another search engine."
Patrissia Cuberos,5,"Excellent, non intrusive, not Google and I'm doing something for the environment!"
ultmmm grapes,5,Love this app and what Ecosia does for the Earth! I've been using this browser for a couple of years. It's a good browser for the everyday user! I hope in the future we can add extensions like you can on Chrome. Keep up the good work Team Ecosia 👍
Lasiru Menath Pathirana,5,I'm using ecosia around 3 months from now. And it was very interesting to use because I can help to plant trees with my Internet surfing. And the Ecosia browser is themed to greenery so it's pleasant to using that for a long time. Thanks for reading this.
TheClawNz,5,"Great app, has financial reports every month. Highly recommend that you use this browser!"
NABIL Najmi,3,"Love the concept of plant trees, that's why I use ecosia. But the engine is just too slow. Please improve the loading and response time for this app."
Elden Lim,5,"Been using Ecosia for about 4 years now and it's a great choice for browser app. It includes climate badge ratings of popular websites, which shows each companies' response to the climate crisis. It also shows the approximate number of trees you planted by searching on Ecosia (you need to sign up for an account). You can check out the Ecosia Blog for more information and updates on their efforts in planting trees. One problem is that it is not considered a supported browser by most websites."
Roen H. Berkom,5,I have a very good experience with Ecosia as well as with Google. They are the best!
Lisa Zack,2,"I've used Ecosia for ~5 years. I love the work they are doing to address climate change and deforestation. The built-in ad blocker and option to reject cookies is helpful, but less robust since the June 2023 update. The browser performs moderately well, but is fairly useless for local results. AI-driven auto-completes are laughably poor. The latest update added tab groupings, which renders the platform cumbersome and time-consuming. Google did this to much backlash and then reversed course."
beta Bluegrass,2,"im extremely disappointed by the addition of the generative ai text, which is extremely harmful to the environment due to its immense use of electricity. screw you"
Khushna Shah,5,search away and help the planet. best idea 💡 love it ❤️
happy little kyobashi dragon,5,"great!!! i get to feel good about myself while using this, sustainable, honest and a perfect, discreet browser"
Ernesto Sun,5,A no-regret decision to choose Ecosia. Integrating smoothly and giving a good feeling on top.
Anton Smith,5,This is awesome. I edited my review simply to let Ecosia know that when I uninstalled my amazon app. It also uninstalled Ecosia. They are on separate screens so I did not uninstall Ecosia accidentally thinking it was amazon.
Para Foxical,1,"I've been using ecosia for years, but adding ai was a total deal breaker for me. Uninstalled. Be better."
Filosiphurh,5,"Brilliant app! I use it every day, and when I do, I can be assured that my searches will be going towards helping rejuvenate the planet (≡^∇^≡). Easy 🌟🌟🌟🌟🌟/🌟🌟🌟🌟🌟"
Yashpal Vyas,5,Really a great thing to environment 🎩🎩 hats off
ãųř ùm,5,Awesome experience! Very user friendly. Highly recommended. Let's save our Mother Earth together. ❤️
Wolf Grey,4,"Ecosia is a good enough search engine for most people who casually browse the Internet to use. It's certainly no Google on quality or Tor in privacy, but considering their value of your privacy and the fact that you actively support social and planetary change just by using a different search engine ? I'll be a user for as long as Ecosia exists as they currently do. I've already talked my mother and grandmother into using it as well !"
The Dealer,5,"Looks legit. Also this app got built-in adblock, which already makes it better than Google Chrome. P.S tho this browser is quite good, i switched to Privacy Browser + Ecosia as a search engine. P.S2 Switched back 🤷🏻‍♂️"
Ciara Eloise Dela Paz,5,Their cause is nothing to be questioned. Go Ecosia! ❤️🌱🌎
Fina Franqueiro,5,I love the fact that my research has an impact on the planet.
Paulius Narkevičius,4,CO2 main driving force here. What about the rest of problems? Recycling and Plastic...
Chris Davis,2,"I was going to try ecosia out, was putting in all of my setting preferences when @the very end there's an option to see ""new options"". READ.Starting Sept 2023 ecosia will begin giving your unencrypted ip address and allow Google to insert a cookie that ""will protect from bot attacks and spam"".Shame on u ecosia.You don't collect, but you allow these others to do the dirty work.Own your behavior. I will uninstall asap. What a shame."
Manilyn Sansano,5,Download now to save our planet
GreenFlashAtSunsetッ,3,"Heyy 👋 on a recent update, you guys seem to have integrated the mobile features of certain websites even when I use ""desktop site."" ☹️ I liked using *Goodreads* on Ecosia, but strictly the desktop view only bc I absolutely hate the Goodreads interface on mobile view and app. But Ecosia now shows its mobile/app view, even when i toggle to Desktop. Other browsers still ok. I'm sure this affects other websites bc I don't see why you would single out Goodreads, but pls bring back desktop view!!"
M Billinge,4,"Works well, and does most things Chrome does. However, I do wish it was upgraded and patched more quickly. Tempted use the Opera browser with Ecosia set as the default search engine."
Raquel Vatamaniuk,5,"Ecosia is one of the things I do for the planet, that truly feels like I'm making a difference. Because: 1. I'm contributing to a company that plants native trees where they're critically needed, without plastic containers. 2. Ecosia has an incredible system to keep the young trees 🌱 alive with minimal effort. 3. Ecosia employs the native populations to help plant the trees. 5. Recycling/composting is a good effort.👍 It is still a one-time effort. Ecosia is a compound interest 📈 powerhouse."
